name,brand,url,price,original_price,rating_average,discount,discount_rate,review_count
Camera IP Wifi Trong Nhà EZVIZ C6N 1080p - Hàng Chính Hãng,"""EZVIZ""",https://tiki.vn/product-p41319582.html?spid=48652710,349000,959000,4.7,610000,64,4611
Camera IP Wifi Trong Nhà EZVIZ C6N 1080p (CS-C6N) - Hàng Chính Hãng,"""EZVIZ""",https://tiki.vn/product-p46462092.html?spid=48657149,349000,891000,4.6,542000,61,529
Camera IP Wifi TP-Link Tapo C200 Full HD 1080P Giám sát An Ninh - Hàng Chính Hãng,"""TP-Link""",https://tiki.vn/product-p74500335.html?spid=74500336,459000,899000,4.7,440000,49,2919
Camera IP Wifi Trong Nhà Ezviz Mini CS-C1C-B 1080p - Hàng Chính Hãng,"""EZVIZ""",https://tiki.vn/product-p84866683.html?spid=157218954,436000,990000,4.7,554000,56,542
"Camera Wifi IPC360 Home PC206, ống kính kép 1080P (FHD), màn hình đôi , chống nước IP66 dùng cho ngoài trời (Hàng nhập khẩu)","""IPC360""",https://tiki.vn/product-p272061200.html?spid=273603065,499000,750000,4.6,251000,33,41
"Camera Wifi IPC360 Home PC203, ống kính kép 1080P (FHD), màn hình đôi (Hàng nhập khẩu)","""IPC360""",https://tiki.vn/product-p272391998.html?spid=272392001,780000,780000,4.6,0,0,26
Thẻ nhớ SDXC SanDisk Extreme Pro SDSDXXU-064G U3 V30 64GB 200MB/s New 2022 - Hàng Nhập Khẩu,"""SanDisk""",https://tiki.vn/product-p193717163.html?spid=193717165,315000,315000,5.0,0,0,101
Camera Wifi Yoosee 2 Mắt Xem 2 Màn Hình Cùng Lúc Ngoài Trời - Hàng Nhập Khẩu,"""Yoosee""",https://tiki.vn/product-p262792654.html?spid=270466595,343000,390000,4.5,47000,12,47
Camera IP wifi trong nhà IMOU Ranger 2 2MP/4MP - Hàng Chính Hãng,"""IMOU""",https://tiki.vn/product-p142796515.html?spid=192975507,520000,520000,5.0,0,0,4
"Bộ giá đỡ điện thoại, máy ảnh 3 chân tripod","""OEM""",https://tiki.vn/product-p5452277.html?spid=34160464,65000,65000,4.2,0,0,85
Combo Camera WiFi TP-Link Tapo C200 2MP và Thẻ Nhớ MicroSD Kioxia/Dahua/Lexar 32Gb/64Gb/128Gb - Hàng Chính Hãng,"""TP-Link""",https://tiki.vn/product-p187623126.html?spid=271427917,739000,1339000,4.8,600000,45,159
Camera IP WiFi Ngoài Trời EZVIZ H8 2K (2304 × 1296p) - Hàng chính hãng,"""EZVIZ""",https://tiki.vn/product-p205985107.html?spid=214770147,1146000,2244000,4.8,1098000,49,52
"Camera Wifi IPC360 Home chuôi bóng đèn NDP2-10 1080P (FHD), xoay ngang 360 độ, thu phóng 8 lần (Hàng nhập khẩu)","""IPC360""",https://tiki.vn/product-p272061224.html?spid=273768159,299000,429000,5.0,130000,30,7
"Đầu đọc thẻ nhớ đa năng 4in1 usb 2.0 cho máy ảnh điện thoại Iphone, Samsung, Sony, đầu lọc thẻ SD, MICRO SD, CF, TF, MMC","""OEM""",https://tiki.vn/product-p252768590.html?spid=252768591,24000,35000,5.0,11000,31,1
Camera Thông Minh Xiaomi C200 / C300 / C400 / AW200 / AW300 Bản Quốc Tế - Hàng Chính Hãng FPT,"""Xiaomi""",https://tiki.vn/product-p270214258.html?spid=270214260,634000,950000,4.8,316000,33,8
"Camera Wifi Trong Nhà Yoosee 3.0 Full HD, 3 Râu, Xoay 360 độ , Đàm Thoại 2 Chiều, Cảm Biến Báo Động – Hàng nhập khẩu","""Yoosee""",https://tiki.vn/product-p106641569.html?spid=106641571,230000,299000,4.6,69000,23,567
"Chân Đế Camera Xoay 360 độ, chuyên dùng cho Camera Ezviz C6N Camera Imou A22Ep Camera Kbone H21PW","""OEM""",https://tiki.vn/product-p74610299.html?spid=164076281,6690,6690,5.0,0,0,67
"Camera Yoosee Wifi 2 Mắt Ngoài Trời 2 Màn Hình 5MP Xem Đêm Có Màu, Hỗ Trợ Đàm Thoại 2 Chiều Xoay 360 Độ - Hàng Nhập Khẩu","""Yoosee""",https://tiki.vn/product-p270977170.html?spid=270977171,343000,390000,4.8,47000,12,11
Thẻ nhớ SDHC SanDisk Ultra 120MB/s 32GB - Hàng Nhập Khẩu,"""SanDisk""",https://tiki.vn/product-p261813781.html?spid=261813782,145000,145000,4.5,0,0,5
Thẻ nhớ SDXC SanDisk Extreme Pro SDSDXXD-128G U3 V30 128GB 200MB/s New 2022 - Hàng Nhập Khẩu,"""SanDisk""",https://tiki.vn/product-p194140440.html?spid=194140441,515000,515000,5.0,0,0,64
Thẻ nhớ SDXC SanDisk Extreme U3 V30 64GB 170MB/s SDSDXV2-064G (New 2022) - Hàng Nhập Khẩu,"""SanDisk""",https://tiki.vn/product-p195863820.html?spid=195863822,265000,265000,4.8,0,0,38
Camera IMOU wifi A22EP 1080P 2M xoay 360 độ đàm thoại 2 chiều - Hàng chính hãng,"""IMOU""",https://tiki.vn/product-p242618146.html?spid=170267666,455000,800000,4.7,345000,43,133
" Camera WiFi Xoay 360° Gắn Đui Bóng Đèn, Đàm Thoại Hai Chiều, Báo Động Chống Trộm, Ban Đêm Có Màu, Wifi Không Dây Trong Nhà","""OEM""",https://tiki.vn/product-p214798796.html?spid=271590143,173000,187000,5.0,14000,7,5
[Chân chụp ảnh] Chân đế Tripod Bluetooth cho điện thoại và máy ảnh TTX - 6218 (Kèm túi đựng và remote bluetooth) - Hàng nhập khẩu,"""OEM""",https://tiki.vn/product-p47030777.html?spid=47030778,292000,440000,4.8,148000,34,101
Thẻ nhớ IMOU chuyên dụng cho Camera 95 MB/s Class 10 32GB/64GB - Hàng Chính Hãng,"""IMOU""",https://tiki.vn/product-p153998709.html?spid=153998711,110000,125000,4.8,15000,12,105
Film Instax Mini - Giấy in ảnh Fujifilm cho máy chụp ảnh lấy liền Instax Mini - Hộp 20 tấm - Hàng Chính Hãng,"""Fujifilm""",https://tiki.vn/product-p381162.html?spid=84326569,384000,480000,4.8,96000,20,50
"Chân máy/ Tripod Yunteng VCT 668, chân đế điện thoại và máy ảnh - Hàng chính hãng","""Yunteng""",https://tiki.vn/product-p270527462.html?spid=270527463,541000,800000,4.3,259000,32,3
"Tripod - Chân đế điện thoại, chân đế máy ảnh Yunteng VCT 5208 kiêm giá đỡ có remote Bluetooth điều khiển chụp từ xa","""Yunteng""",https://tiki.vn/product-p114789403.html?spid=156204898,306000,399000,4.8,93000,23,22
Tay cầm chống rung Gimbal DJI OM6 - Osmo Mobile 6 - Hàng Chính Hãng,"""DJI""",https://tiki.vn/product-p270139898.html?spid=198739087,3156000,3322000,4.8,166000,5,36
Camera IP Wifi Ngoài Trời Imou F22P Bullet 2C Full HD 1080P Tặng Phíc Cắm Âm - Hàng Chính Hãng,"""IMOU""",https://tiki.vn/product-p72556060.html?spid=165690260,612000,612000,5.0,0,0,7
"Tripod 3Chân Dùng Cho Máy Chiếu Beecube (Bản Cao Cấp, Nhỏ Gọn)","""OEM""",https://tiki.vn/product-p213960838.html?spid=213960839,250000,300000,4.5,50000,17,4
Gói hút ẩm silica gel 100 gram (10 túi/ bịch) - Hàng chính hãng,"""Secco""",https://tiki.vn/product-p9799302.html?spid=10716664,99000,99000,4.7,0,0,106
Pin sạc Panasonic Eneloop AA 2550mah BK-3HCCE4BT3 (Vỉ 4 viên) (Đen) - Hàng chính hãng,"""Panasonic""",https://tiki.vn/product-p48316743.html?spid=57407315,409000,425000,5.0,16000,4,61
"Camera Yoosee bóng đèn thế hệ mới 3.0MP - xoay 360 độ, xem đêm có màu, mẫu mới 2022 - Hàng Nhập Khẩu","""Yoosee""",https://tiki.vn/product-p205224085.html?spid=218979539,250000,405000,4.0,155000,38,6
"Camera WiFi TP-Link Tapo C510W / C520WS An Ninh Quay/Quét 360 Độ, Chống Nước - Hàng Chính Hãng","""TP-Link""",https://tiki.vn/product-p272967613.html?spid=272967622,1509000,2879000,5.0,1370000,48,4
Camera Wifi TP-Link Tapo C310 3MP An Ninh Ngoài Trời - Hàng Chính Hãng,"""TP-Link""",https://tiki.vn/product-p85764360.html?spid=102575962,740000,740000,4.8,0,0,28
Camera Wifi TP-Link Tapo C210 Độ Phân Giải 3MP Lưu trữ 256GB Giám Sát An Ninh - Hàng Chính Hãng,"""TP-Link""",https://tiki.vn/product-p107356974.html?spid=107356975,589000,1178000,4.7,589000,50,180
Bộ KIT Studio Chụp Ảnh Sản Phẩm Chân Đèn 2m Kèm Softbox 50x70 cm Hỗ Trợ Sáng(Không bóng đèn),"""OEM""",https://tiki.vn/product-p253632196.html?spid=131527401,255000,255000,5.0,0,0,4
Pin Sạc AA Eneloop Pro 2550 mah Made In Japan - Hàng Chính Hãng ( Panasonic Việt Nam nhập khẩu và Phân Phối),"""Panasonic""",https://tiki.vn/product-p28324579.html?spid=55772593,409000,425000,4.8,16000,4,23
Pin D Carbon Panasonic R20UT/2S chính hãng,"""Panasonic""",https://tiki.vn/product-p56451960.html?spid=56451961,35000,35000,4.8,0,0,34
"Camera Wifi imou A42P 4MP 2K, Ranger 2 A22 Xoay 360 độ - Imou C22 đàm thoại 2 chiều - hàng chính hãng","""IMOU""",https://tiki.vn/product-p253183156.html?spid=253183165,390000,450000,5.0,60000,13,4
Camera WiFi TP-Link Tapo C500 An Ninh Quay/Quét Ngoài Trời - Hàng Chính Hãng,"""TP-Link""",https://tiki.vn/product-p213710314.html?spid=225947220,919000,919000,5.0,0,0,3
Chân đế Tripod cho điện thoại và máy ảnh 3366 cao cấp - Tặng kèm remote Bluetooth  - Hàng nhập khẩu,"""OEM""",https://tiki.vn/product-p35795143.html?spid=186095423,138588,138588,5.0,0,0,1
"Camera Xiaomi 360 Imilab Home Security Chất Lượng Cao 1296x2304, Đàm Thoại 2 Chiều, Chế Độ Hồng Ngoài Ban Đêm, Chế Độ Chống Trộm - Hàng chính hãng","""Xiaomi""",https://tiki.vn/product-p75664666.html?spid=75664667,799000,899000,4.6,100000,11,91
Chân Đế Dome cho camera IMOU,"""OEM""",https://tiki.vn/product-p204038299.html?spid=204038300,14000,15000,4.8,1000,7,6
Ống Nhòm Một Mắt Tầm Nhìn 8000m - Hàng Nhập Khẩu,"""OEM""",https://tiki.vn/product-p43107996.html?spid=107326759,175000,175000,4.1,0,0,19
Chân đế quay phim chụp ảnh cho điện thoại kiêm gậy tự sướng bluetooth Yunteng VCT 1688 - Hàng nhập khẩu,"""Yunteng""",https://tiki.vn/product-p32593849.html?spid=186274443,279000,399000,5.0,120000,30,12
Dây đeo chống mỏi canvas cho máy ảnh - Q00311,"""OEM""",https://tiki.vn/product-p13406602.html?spid=58002464,49500,49500,5.0,0,0,42
Camera Wifi imou dùng sim 4G - S21FTP IMOU Cruiser 4G - Hàng chính hãng,"""IMOU""",https://tiki.vn/product-p270773113.html?spid=270773257,1035500,1090000,0.0,54500,5,0
Hạt Hút Ẩm Xanh Cho Máy Ảnh Kèm Túi Đựng (Silica Gel),"""OEM""",https://tiki.vn/product-p32809813.html?spid=35323241,29000,29000,4.6,0,0,91
"Gậy Tripod 3 chân 3366 Kèm giá đỡ cho điện thoại / Gậy 3120 /Chân siêu chắc chắn,cao cấp tương thích với nhiều dòng máy","""OEM""",https://tiki.vn/product-p113951659.html?spid=248686379,72000,72000,0.0,0,0,0
"Camera mini siêu nhỏ giám sát A9 FullHD 1080p IP wifi kết nối với điện thoại, có pin","""OEM""",https://tiki.vn/product-p101349749.html?spid=263576961,298000,298000,0.0,0,0,0
Camera Wifi Yoosee PTZ 2 Mắt Xoay 360 Độ - Đàm Thoại 2 Chiều - Báo Động Chống Trộm - Ban Đêm Có Màu - hàng nhập khẩu,"""Yoosee""",https://tiki.vn/product-p273474185.html?spid=270977296,417000,450000,4.2,33000,7,13
"Camera IMOU Bullet 2/2C/2E 2MP ( IPC-F22P), Camera Ngoài Trời, Chống nước IP67, Chuẩn nén H265, Theo dõi chuyển động, Quay Màu ban đêm - Hãng Chính Hãng","""IMOU""",https://tiki.vn/product-p145180531.html?spid=145180535,908000,925000,4.6,17000,2,11
"Ulanzi MT-44 - Tripod Mini Cho Máy Ảnh, Điện Thoại, Tải Trọng 1.5 Kg, Chiều Cao Tối Đa 109cm- Hàng chính hãng","""Ulanzi""",https://tiki.vn/product-p271381019.html?spid=271381022,389000,389000,4.8,0,0,5
Chân đế gắn tường cho Camera ,"""OEM""",https://tiki.vn/product-p170262116.html?spid=170262117,20000,35000,4.8,15000,43,16
"Bộ đèn studio chụp ảnh sản phẩm, quay phim, livestream chuyên nghiệp, bộ gồm chân đèn 2m kèm softbox 50x70cm, bóng đèn Led Bulb","""OEM""",https://tiki.vn/product-p65576750.html?spid=65576752,375000,650000,4.3,275000,42,31
Camera Yoosee WiFi 2 Mắt Ngoài Trời QPT36 Xem 2 Màn Hình Cùng Lúc 5.0Mpx Giám Sát Ngoài Trời Chống Nước IP66 - Hàng Chính Hãng,"""VIETHAS""",https://tiki.vn/product-p270545009.html?spid=270545011,375000,580000,5.0,205000,35,2
Bộ sạc và pin PANASONIC Eneloop CC51E ( 2 viên AA 2000mAh) - Hàng chính hãng,"""Panasonic""",https://tiki.vn/product-p4364947.html?spid=67107261,379000,390000,5.0,11000,3,57
Combo Camera IP Wifi EZVIZ C6N 2MP (1080P) và Thẻ Nhớ 32GB - Hàng Chính Hãng,"""EZVIZ""",https://tiki.vn/product-p103995541.html?spid=103995542,439000,439000,4.8,0,0,120
Camera Wifi Yoosee 5MP Ngoài Trời Xem Đêm Có Màu - Đàm Thoại 2 Chiều - Phát Hiện Chuyển Động - Hàng Nhập Khẩu,"""Yoosee""",https://tiki.vn/product-p273450410.html?spid=273450415,370500,390000,4.8,19500,5,11
"Chân máy YUNTENG VCT-691RM dùng cho máy ảnh, máy quay và điện thoại ( Kèm đầu kẹp xoay 360 độ, Remote và túi đựng) - Hàng chính hãng","""Yunteng""",https://tiki.vn/product-p262590123.html?spid=262590124,668000,1000000,5.0,332000,33,3
Bộ 2 Pin AA Panasonic Eneloop 2000mAh - Hàng chính hãng,"""Panasonic""",https://tiki.vn/product-p2416333.html?spid=57421573,195000,198000,5.0,3000,2,58
"Camera wifi gia đình IMOU Ranger 2 A42P 4MP chính hãng xoay 360 độ , đàm thoại hai chiều , nhận thông báo khi phát hiện chuyển động và tiếng động lạ - Hàng Chính Hãng","""IMOU""",https://tiki.vn/product-p106661426.html?spid=143487339,707000,707000,4.6,0,0,74
"Chân Đế Camera XOAY 360 độ hình cánh quạt, HÀNG NHƯ HÌNH.","""OEM""",https://tiki.vn/product-p110846231.html?spid=110846233,7500,7500,4.8,0,0,21
"Camera IP Wifi imou IPC GS7EP-5M0WE 5MP 3K Full Color, GS7EP 3MP quay quét Ngoài Trời, Cảnh báo, đèn còi - Hàng chính hãng","""IMOU""",https://tiki.vn/product-p253190631.html?spid=253190635,1187500,1250000,4.6,62500,5,7
Thẻ nhớ 32/64/128/256gb MIXIE  MicroSD  Class10 U3. Hàng Chính Hãng.,"""MIXIE""",https://tiki.vn/product-p135839773.html?spid=214664921,59000,59000,5.0,0,0,8
Camera Yoosee Bóng Đèn Thế Hệ Mới 8 Led 5.0Mp Góc Rộng Siêu Nét Full Hd Hồng Ngoại Quay Đêm Hàng Chính Hãng,"""Yoosee""",https://tiki.vn/product-p200004710.html?spid=215842919,240000,240000,3.6,0,0,5
Film Instax Mini - Giấy in ảnh cho máy chụp ảnh lấy liền Instax Mini - Hàng Chính Hãng,"""Fujifilm""",https://tiki.vn/product-p193509839.html?spid=193509858,384000,525000,5.0,141000,27,11
Túi đựng máy ảnh dây rút nhỏ gọn chống thấm nước có dây đeo chéo,"""OEM""",https://tiki.vn/product-p199631218.html?spid=199631220,200000,200000,5.0,0,0,6
"Chân máy ảnh Tripod 3110 tặng Giá kẹp điện thoại, Remote bluetooth và Túi đựng","""OEM""",https://tiki.vn/product-p7176411.html?spid=32596654,61900,61900,4.1,0,0,116
Camera Imou Range 2C - New 2021 - Chip Hình Ảnh Thế Hệ Mới - Wifi Cực Mạnh Siêu Khỏe - Hàng Chính Hãng,"""IMOU""",https://tiki.vn/product-p133876927.html?spid=142321130,414000,414000,4.8,0,0,29
"Nguồn 12v 1A chân to cho camera, bộ phát wifi, moden...","""OEM""",https://tiki.vn/product-p111484283.html?spid=271040837,40000,44000,0.0,4000,9,0
"Camera trong nhà Eufy Security Indoor Cam 2K, tích hợp còi báo động - Hàng chính hãng","""Eufy""",https://tiki.vn/product-p82529007.html?spid=82529008,790000,935000,4.8,145000,16,4
"Adapter - Nguồn 12V 2A Chuyên Dùng cho camera Hikvision, Dahua, KBvision, Camera IP, đèn Led, ...","""OEM""",https://tiki.vn/product-p210886294.html?spid=162958813,39000,39000,5.0,0,0,1
Kính Lọc Filter Marumi Fit & Slim Lens Protect 43mm - Hàng Nhập Khẩu,"""Marumi""",https://tiki.vn/product-p5895529.html?spid=50334712,264999,264999,5.0,0,0,5
"Giá kẹp điện thoại Yunteng xoay 360 độ cho chân Tripod, máy ảnh -Hàng Chính Hãng","""Yunteng""",https://tiki.vn/product-p160293671.html?spid=160293678,76500,76500,0.0,0,0,0
Camera Wifi TP-Link Tapo C220 Độ Phân Giải 2K QHD Quay/Quét 360 Độ Giám Sát An Ninh - Hàng Chính Hãng,"""TP-Link""",https://tiki.vn/product-p270906792.html?spid=273406851,679000,679000,0.0,0,0,0
"Máy bay Flycam mini 4k giá rẻ Drone E88 Pro 2 camera kép kết nối WIFI 2.4GHZ, ĐỘ PHÂN GIẢI 4K, Bay cao 100m, nhào lộn 360 độ thích làm đồ chơi cho bé Tặng túi đựng chống sốc - Hàng chính hãng","""ASPORT""",https://tiki.vn/product-p270772763.html?spid=270772769,291000,750000,4.8,459000,61,8
Thẻ nhớ SDHC SanDisk Extreme Pro SDSDXXO-032G U3 V30 32GB 100MB/s New 2022 - Hàng Nhập Khẩu,"""SanDisk""",https://tiki.vn/product-p194139957.html?spid=194139959,245000,245000,5.0,0,0,6
Pin Sạc AAA Eneloop Panasonic - Hàng Chính Hãng,"""Panasonic""",https://tiki.vn/product-p20589215.html?spid=55773006,195000,198000,5.0,3000,2,83
Bộ Phụ Kiện 50 in 1 cho GOPRO Hộp Đựng Cao Cấp Tặng Kèm Phao Nổi - Black,"""OEM""",https://tiki.vn/product-p18005129.html?spid=55088112,369000,369000,4.5,0,0,83
Chân giá đỡ Tripod 3366 cao 150cm kèm Remote chụp ảnh - Hàng nhập khẩu,"""OEM""",https://tiki.vn/product-p28240413.html?spid=56049041,148500,148500,4.2,0,0,28
"Camera ip Wifi Yoosee Ngoài Trời 26 Led Chuẩn 1080P, Mẫu mới 2021- Hàng Nhập Khẩu","""Yoosee""",https://tiki.vn/product-p204666560.html?spid=212603880,247000,270000,4.5,23000,9,7
Camera hành trình ô tô 70MAI Pro Plus A500S tích hợp sẵn GPS - Hàng Chính Hãng,"""70mai""",https://tiki.vn/product-p117486463.html?spid=117486464,1558000,1648000,5.0,90000,5,7
"Camera WIFI ngoài trời IMOU S21FP, S41FP có màu ban đêm, xoay 360 độ - Hàng chính hãng","""IMOU""",https://tiki.vn/product-p242644479.html?spid=248879970,770000,950000,4.8,180000,19,4
Camera IP Wifi Trong Nhà EZVIZ C6N 4MP 2K - Hàng Chính Hãng,"""EZVIZ""",https://tiki.vn/product-p117076592.html?spid=175214110,618900,618900,4.8,0,0,6
Camera IP Xiaomi Smart Camera C300 360 độ - 2K Hàng Chính Hãng,"""Xiaomi""",https://tiki.vn/product-p224173531.html?spid=270701166,799000,1450000,5.0,651000,45,2
Camera Eufy Security Indoor Cam 2K Công nghệ AI Xoay 360 độ Đàm thoại 2 chiều - Hàng Chính Hãng,"""Eufy""",https://tiki.vn/product-p81209881.html?spid=83410001,910000,910000,5.0,0,0,23
"[Bảo Hành 12 Tháng] Camera Wifi YOOSEE 2 Mắt Ngoài Trời QC48 Có Còi Hú Báo Động 5.0Mpx Full HD - Xoay 360 Độ, Xem Ban Đêm Có Màu Đàm Thoại 2 Chiều - Hàng Chính Hãng","""VIETHAS""",https://tiki.vn/product-p271219137.html?spid=271219139,463000,690000,5.0,227000,33,3
Camera IP Xiaomi Mi Home Magnetic Mount MJSXJ03HL Trắng - Hàng Nhập Khẩu,"""Xiaomi""",https://tiki.vn/product-p217292399.html?spid=217292404,479000,599000,4.1,120000,20,10
Camera quan sát hành trình wifi V99S FullHD 1080P 4K xem từ xa qua điện thoại,"""OEM""",https://tiki.vn/product-p225209107.html?spid=225209109,625000,625000,2.0,0,0,1
Camera IP Imou C22SP 1080p - Hàng Chính Hãng,"""IMOU""",https://tiki.vn/product-p142217257.html?spid=189542813,456800,456800,4.7,0,0,11
Bộ Vệ Sinh Máy Ảnh 3 In 1 - Hàng Nhập Khẩu,"""OEM""",https://tiki.vn/product-p2566051.html?spid=55088157,58000,58000,4.7,0,0,56
Máy ảnh chụp lấy liền Fujifilm Instax Mini 12 - Hàng chính hãng,"""Fujifilm""",https://tiki.vn/product-p263752818.html?spid=263752824,2020000,3120000,5.0,1100000,35,2
Camera Wifi TP-Link Tapo C211 Độ Phân Giải 2K UHD Quay Quét 360 Độ - Hàng Chính Hãng,"""TP-Link""",https://tiki.vn/product-p272366633.html?spid=272366635,649000,1298000,5.0,649000,50,1
"Camera Xiaomi Wifi 360 Mi Home Security Độ Phân Giải Full HD 1080P Đàm Thoại 2 Chiều Cảm Biến Chuyển Động, Chế Độ Chống Trộm - Hàng chính hãng","""Xiaomi""",https://tiki.vn/product-p75540518.html?spid=251462096,626000,659000,4.7,33000,5,3
Pin LP-E8 dùng cho máy ảnh Canon 550D 600D 650D 700D - Hàng nhập khẩu,"""OEM""",https://tiki.vn/product-p40757037.html?spid=157200033,199999,199999,5.0,0,0,15
"Camera wifi mini A9 không dây chống trộm kết nối điện thoại từ xa góc quay 120 độ Full HD 1080P, camera IP mini có Led hồng ngoại","""OEM""",https://tiki.vn/product-p199972877.html?spid=271342064,52998,52998,1.3,0,0,3
"Gimbal chống rung điện thoại Q18, Gimbal điện thoại theo dõi chuyển động, Điều khiển từ xa, Gymbal chống rung - Hàng chính hãng","""aochuan""",https://tiki.vn/product-p273259541.html?spid=273259543,584000,1000000,5.0,416000,42,1
